tt16360006	50549	Bubble
tt9598270	34439	Code Geass: Hangyaku no Lelouch II - Handou
tt9844256	34440	Code Geass: Hangyaku no Lelouch III - Oudou
tt8100900	34438	Code Geass: Hangyaku no Lelouch I - Koudou
tt9277666	6624	Kara no Kyoukai Remix: Gate of Seventh Heaven
tt1155650	2593	Kara no Kyoukai Movie 1: Fukan Fuukei
tt1155651	3782	Kara no Kyoukai Movie 2: Satsujin Kousatsu (Zen)
tt1155652	3783	Kara no Kyoukai Movie 3: Tsuukaku Zanryuu
tt1233474	4280	Kara no Kyoukai Movie 4: Garan no Dou
tt1278060	4282	Kara no Kyoukai Movie 5: Mujun Rasen
tt1343089	5204	Kara no Kyoukai Movie 6: Boukyaku Rokuon
tt1345776	5205	Kara no Kyoukai Movie 7: Satsujin Kousatsu (Go)
tt3868344	6954	Kara no Kyoukai Movie 8: Shuushou
tt11032374	40456	Kimetsu no Yaiba Movie: Mugen Ressha-hen
tt10253816	34544	Koutetsujou no Kabaneri Movie 3: Unato Kessen
tt10068158	37514	Made in Abyss Movie 1: Tabidachi no Yoake
tt10068544	37515	Made in Abyss Movie 2: Hourou Suru Tasogare
tt15497404	48375	Mahouka Koukou no Rettousei: Tsuioku-hen
tt13288678	37765	Mobile Suit Gundam: Hathaway's Flash
tt7933596	35949	Mobile Suit Gundam Thunderbolt: Bandit Flower
tt11107074	39565	Boku no Hero Academia the Movie 2: Heroes:Rising
tt13651628	44807	Ryuu to Sobakasu no Hime
tt6337252	34504	Seitokai Yakuindomo Movie
tt12439230	40814	Seitokai Yakuindomo Movie 2
tt12642574	35759	Sidonia no Kishi: Ai Tsumugu Hoshi
tt13424422	42916	Sword Art Online: Progressive Movie - Hoshi Naki Yoru no Aria
tt8652818	37987	Violet Evergarden Movie
tt0113568	43	Ghost in the Shell
tt0347246	468	Ghost in the Shell 2 : Innocence
tt1260502	4672	Ghost in the Shell 2.0
tt6078840	36098	Kimi no Suizou wo Tabetai
